{
  "schema_version": "1.0.0",
  "identity": {
    "institution": "Universidad Nacional de Colombia",
    "campus": "Bogotá",
    "faculty": "Facultad de Ciencias",
    "program": "Estadística",
    "program_code": "2514",
    "snies": "32",
    "degree_name": "Estadístico(a)",
    "estimated_terms": 9,
    "total_required_credits": 141
  },
  "revision": {
    "revision_code": "2514-AC496-2023",
    "effective_from": "2023-05-09",
    "status": "SOURCE_BASELINE",
    "note": "Dataset de arranque para revisión humana; no representa una publicación interna de la futura plataforma."
  },
  "components": [
    {
      "id": "FOUNDATION",
      "name": "Fundamentación",
      "required_credits": 52,
      "mandatory_credits": 36,
      "elective_credits": 16
    },
    {
      "id": "DISCIPLINARY",
      "name": "Formación Disciplinar o Profesional",
      "required_credits": 61,
      "mandatory_credits": 20,
      "elective_credits": 41
    },
    {
      "id": "FREE_ELECTIVE",
      "name": "Libre Elección",
      "required_credits": 28,
      "mandatory_credits": 0,
      "elective_credits": 28
    }
  ],
  "groups": [
    {
      "id": "FUND_MATH_STATS",
      "name": "Fundamentación Matemático-Estadística",
      "component": "FOUNDATION",
      "required_credits": 36
    },
    {
      "id": "FUND_SCIENCE",
      "name": "Fundamentación de Ciencias",
      "component": "FOUNDATION",
      "required_credits": 3
    },
    {
      "id": "COMP_MATH",
      "name": "Complementación Matemática",
      "component": "FOUNDATION",
      "required_credits": 4
    },
    {
      "id": "PROGRAMMING",
      "name": "Programación",
      "component": "FOUNDATION",
      "required_credits": 3
    },
    {
      "id": "COMMUNICATION",
      "name": "Comunicación",
      "component": "FOUNDATION",
      "required_credits": 3
    },
    {
      "id": "DATA_FLOW",
      "name": "Guarda y Flujo de Datos",
      "component": "FOUNDATION",
      "required_credits": 3
    },
    {
      "id": "STAT_CORE",
      "name": "Núcleo Estadístico",
      "component": "DISCIPLINARY",
      "required_credits": 36
    },
    {
      "id": "STAT_APPLICATION",
      "name": "Aplicación Estadística",
      "component": "DISCIPLINARY",
      "required_credits": 6
    },
    {
      "id": "STAT_COMPLEMENT",
      "name": "Complementación Estadística",
      "component": "DISCIPLINARY",
      "required_credits": 4
    },
    {
      "id": "METHODOLOGY",
      "name": "Metodología",
      "component": "DISCIPLINARY",
      "required_credits": 3
    },
    {
      "id": "STAT_CONSOLIDATION",
      "name": "Consolidación Estadística",
      "component": "DISCIPLINARY",
      "required_credits": 12
    },
    {
      "id": "FREE_ELECTIVE",
      "name": "Libre Elección",
      "component": "FREE_ELECTIVE",
      "required_credits": 28
    }
  ],
  "courses": [
    {
      "code": "1000001",
      "name": "Matemáticas básicas",
      "credits": null
    },
    {
      "code": "1000004",
      "name": "Cálculo diferencial",
      "credits": null
    },
    {
      "code": "1000019",
      "name": "Fundamentos de mecánica",
      "credits": null
    },
    {
      "code": "2016046",
      "name": "Mercados I",
      "credits": null
    },
    {
      "code": "2016610",
      "name": "Sistemas de costos",
      "credits": null
    },
    {
      "code": "2015168",
      "name": "Fundamentos de matemáticas",
      "credits": 4
    },
    {
      "code": "2015181",
      "name": "Sistemas Numéricos",
      "credits": 4
    },
    {
      "code": "2016377",
      "name": "Cálculo diferencial en una variable",
      "credits": 4
    },
    {
      "code": "2015556",
      "name": "Cálculo integral en una variable",
      "credits": 4
    },
    {
      "code": "2015162",
      "name": "Cálculo vectorial",
      "credits": 4
    },
    {
      "code": "2015555",
      "name": "Álgebra lineal básica",
      "credits": 4
    },
    {
      "code": "2016378",
      "name": "Álgebra matricial",
      "credits": 4
    },
    {
      "code": "2015178",
      "name": "Probabilidad",
      "credits": 4
    },
    {
      "code": "2016379",
      "name": "Inferencia estadística",
      "credits": 4
    },
    {
      "code": "1000009",
      "name": "Biología general",
      "credits": 3
    },
    {
      "code": "1000010",
      "name": "Biología molecular y celular",
      "credits": 3
    },
    {
      "code": "1000011",
      "name": "Fundamentos de ecología",
      "credits": 3
    },
    {
      "code": "1000013",
      "name": "Probabilidad y estadística fundamental",
      "credits": 3
    },
    {
      "code": "1000012",
      "name": "Bioestadística fundamental",
      "credits": 3
    },
    {
      "code": "1000014",
      "name": "Estadística social fundamental",
      "credits": 3
    },
    {
      "code": "2015172",
      "name": "Geometría elemental",
      "credits": 4
    },
    {
      "code": "2025819",
      "name": "Introducción a la teoría de conjuntos",
      "credits": 4
    },
    {
      "code": "1000008",
      "name": "Geometría vectorial y analítica",
      "credits": 4
    },
    {
      "code": "2025963",
      "name": "Matemáticas discretas I",
      "credits": 4
    },
    {
      "code": "1000024",
      "name": "Principios de química",
      "credits": 3
    },
    {
      "code": "1000034",
      "name": "Química orgánica I",
      "credits": 3
    },
    {
      "code": "1000041",
      "name": "Química básica",
      "credits": 3
    },
    {
      "code": "1000040",
      "name": "Introducción a la ciencia de materiales",
      "credits": 3
    },
    {
      "code": "2015176",
      "name": "Mecánica newtoniana",
      "credits": 4
    },
    {
      "code": "1000018",
      "name": "Fundamentos de física moderna",
      "credits": 3
    },
    {
      "code": "2015155",
      "name": "Introducción al análisis real",
      "credits": 4
    },
    {
      "code": "2015152",
      "name": "Grupos y anillos",
      "credits": 4
    },
    {
      "code": "2016342",
      "name": "Cálculo de ecuaciones diferenciales ordinarias",
      "credits": 4
    },
    {
      "code": "2015177",
      "name": "Modelos matemáticos",
      "credits": 4
    },
    {
      "code": "2015161",
      "name": "Análisis estocástico",
      "credits": 4
    },
    {
      "code": "2015180",
      "name": "Programación y métodos numéricos",
      "credits": 4
    },
    {
      "code": "2001839",
      "name": "Programación de computadores",
      "credits": 3
    },
    {
      "code": "2016374",
      "name": "Programación en lenguajes estadísticos",
      "credits": 4
    },
    {
      "code": "2015970",
      "name": "Métodos numéricos",
      "credits": 3
    },
    {
      "code": "2015150",
      "name": "Análisis numérico",
      "credits": 4
    },
    {
      "code": "2016375",
      "name": "Programación orientada a objetos",
      "credits": 3
    },
    {
      "code": "2015709",
      "name": "Comunicación oral y escrita",
      "credits": 3
    },
    {
      "code": "2016343",
      "name": "Español funcional",
      "credits": 3
    },
    {
      "code": "2016353",
      "name": "Bases de datos",
      "credits": 3
    },
    {
      "code": "2016699",
      "name": "Estructura de datos",
      "credits": 3
    },
    {
      "code": "2025982",
      "name": "Sistemas de información",
      "credits": 3
    },
    {
      "code": "2016366",
      "name": "Estadística descriptiva y exploratoria",
      "credits": 4
    },
    {
      "code": "2016360",
      "name": "Análisis de regresión",
      "credits": 4
    },
    {
      "code": "2016365",
      "name": "Estadística descriptiva multivariada",
      "credits": 4
    },
    {
      "code": "2016369",
      "name": "Muestreo estadístico",
      "credits": 4
    },
    {
      "code": "2016368",
      "name": "Métodos no paramétricos",
      "credits": 4
    },
    {
      "code": "2016361",
      "name": "Análisis multivariado",
      "credits": 4
    },
    {
      "code": "2016364",
      "name": "Estadística bayesiana",
      "credits": 4
    },
    {
      "code": "2016367",
      "name": "Estadística espacial",
      "credits": 4
    },
    {
      "code": "2016362",
      "name": "Diseño de experimentos",
      "credits": 4
    },
    {
      "code": "2016370",
      "name": "Series del tiempo univariadas",
      "credits": 4
    },
    {
      "code": "2016363",
      "name": "Diseño y desarrollo de encuestas",
      "credits": 4
    },
    {
      "code": "2016328",
      "name": "Modelos de sobrevivencia univariados",
      "credits": 3
    },
    {
      "code": "2016327",
      "name": "Modelos de sobrevivencia multivariados",
      "credits": 3
    },
    {
      "code": "2016318",
      "name": "Demografía",
      "credits": 3
    },
    {
      "code": "2016332",
      "name": "Teoría estadística del riesgo",
      "credits": 3
    },
    {
      "code": "2016320",
      "name": "Epidemiología",
      "credits": 3
    },
    {
      "code": "2016317",
      "name": "Control estadístico de calidad",
      "credits": 3
    },
    {
      "code": "2016329",
      "name": "Muestreo en poblaciones biológicas",
      "credits": 3
    },
    {
      "code": "2016331",
      "name": "Teoría de respuesta al ítem",
      "credits": 3
    },
    {
      "code": "2016321",
      "name": "Finanzas y modelos de inversión",
      "credits": 3
    },
    {
      "code": "2016314",
      "name": "Cálculo actuarial",
      "credits": 3
    },
    {
      "code": "2016055",
      "name": "Tópicos de econometría I",
      "credits": 3
    },
    {
      "code": "2016054",
      "name": "Tópicos de econometría II",
      "credits": 3
    },
    {
      "code": "2016120",
      "name": "Estrategia de mercados",
      "credits": 3
    },
    {
      "code": "2016316",
      "name": "Control de calidad y sistemas de gestión",
      "credits": 3
    },
    {
      "code": "2025995",